{
  "version": "mesh.cos.agent-event.v2",
  "event_id": "event-example-v2",
  "event_sequence": 1,
  "event_timestamp_utc": "2026-08-17T19:00:01+00:00",
  "event_type": "decision.recorded",
  "event_category": "GOVERNANCE",
  "action": "RECORD",
  "actor_type": "AGENT",
  "actor_id": "cos",
  "actor_role": "Executive operating control plane",
  "task_id": "T1",
  "correlation_id": "corr-1",
  "decision_id": "decision-example-v2",
  "parent_event_id": null,
  "run_id": "run-example",
  "authority_level": 3,
  "policy_rule_ids": ["mesh-l3"],
  "capability_tool": "governance-journal",
  "target_resource": "decision-example-v2",
  "source_system": "TaskLedger",
  "input_summary": "A material operating decision required a durable explainable record.",
  "result_status": "SUCCESS",
  "output_summary": "Decision record persisted and linked to the task.",
  "before_state_ref": null,
  "after_state_ref": "TaskLedger:decision_v2:decision-example-v2",
  "evidence_references": ["task:T1"],
  "approval_reference": null,
  "human_approver": null,
  "risk_severity": "LOW",
  "data_classification": "INTERNAL",
  "error_code": null,
  "error_summary": null,
  "idempotency_key": "event-example-v2",
  "model_provider": "OpenAI",
  "model_id_version": "example-model",
  "skill_agent_version": "cos-1.0.0",
  "environment": "TEST",
  "retention_class": "GOVERNANCE_LONG_TERM",
  "previous_event_hash": "GENESIS",
  "event_hash": "bbbbbbbbbbbbbbbbbbbbbbbbbbbbbbbbbbbbbbbbbbbbbbbbbbbbbbbbbbbbbbbb",
  "recorded_at_utc": "2026-08-17T19:00:01+00:00",
  "canonical_record_ref": "TaskLedger:audit_event_v2:event-example-v2"
}
